{
  "verdict": "approve",
  "summary": "La implementación en el backoffice web Angular cumple con todos los requisitos de PLAN-12: pantalla principal de supervisión con KPIs, tarjetas destacadas para desvíos de SLA (Heurística UX 8), grilla reactiva de operadores, mapa interactivo Leaflet/OSM, polling periódico configurable y sanitización estricta de observaciones.",
  "findings": [],
  "next_steps": []
}
