{
  "verdict": "approve",
  "summary": "Se verificaron los cambios en el repositorio backoffice para la tarea PLAN-39. La extracción del patrón de modal compartido a _modal.scss y la actualización justificada de presupuestos de componentes en angular.json resuelven las advertencias de compilación sin regresiones visuales ni de accesibilidad.",
  "findings": [],
  "next_steps": []
}
