{
  "verdict": "approve",
  "summary": "La implementación del backend cubre todos los requerimientos de PLAN-12: migración Flyway V11 con tabla visits.operator_shifts, vista operador_turnos, índices compuestos, endpoints analíticos de supervisión, telemetría de latidos y estricto aislamiento multi-tenant por jurisdicción (OWASP A01).",
  "findings": [],
  "next_steps": []
}
