{
  "verdict": "approve",
  "summary": "Se corrigió la selección del valor en el select de solo lectura mediante el enlace [selected] y se convirtió -webkit-text-fill-color en una propiedad CSS válida en el contrato compartido. Todos los tests, linters y gates pasan satisfactoriamente.",
  "findings": [],
  "next_steps": []
}
