{
  "verdict": "approve",
  "summary": "Revisión de los dos commits de la rama PLAN-34 en frontend: reescritura de la §5 y la conclusión 4 de AUDITORIA_UX_MOVIL.md como protocolo pendiente (quitando resultados fabricados) y nuevo docs/REGISTRO_E2E.md con el recorrido completo a nivel API. El diff es únicamente documentación; cumple los tres criterios de aceptación de la spec y no introduce código. Un hallazgo low sobre una referencia a script no versionado.",
  "findings": [
    {
      "severity": "low",
      "title": "El registro E2E referencia un script que no quedó versionado en el harness",
      "body": "En REGISTRO_E2E.md la sección «Cómo se reproduce» afirma que el script está en `specs/PLAN-34-pruebas-manuales-prueba-de-campo-apk-en/` del harness, pero en el diff de la rama no se agrega ningún script: la carpeta del harness es un repo distinto que no forma parte de este diff. Quien lea el documento desde el repo de frontend va a buscar el script y no va a encontrarlo en ese diff. No bloquea el funcionamiento de la documentación porque el resto describe el recorrido y las credenciales, pero la referencia puntual es inexacta.",
      "file": "docs/REGISTRO_E2E.md",
      "line_start": 60,
      "line_end": 61,
      "confidence": 0.6,
      "recommendation": "Incluir el script reproducible dentro de la carpeta de la spec del harness (o referenciarlo con una ruta absoluta al repo del harness) y ajustar el texto para no sugerir que vive dentro de la rama de frontend."
    }
  ],
  "next_steps": []
}
