{
  "verdict": "approve",
  "summary": "Se implementó correctamente la barra de navegación ergonómica en la pantalla de Hoja de Ruta (src/app/agenda.tsx). Los controles de retorno y de cierre de sesión cumplen con las dimensiones táctiles mínimas (48 dp), atributos de accesibilidad y la protección de datos no sincronizados con confirmSignOut.",
  "findings": [],
  "next_steps": []
}
