{
  "verdict": "approve",
  "summary": "Se implementó un sistema de tokens temáticos adaptativos (LIGHT_THEME y DARK_THEME) con el hook useThemeColors() en layout.ts. Las tarjetas en la pantalla principal y en componentes secundarios ahora cuentan con fondo de superficie opaco y bordes visibles en modo oscuro, y todos los textos tienen colores de alto contraste que cumplen ampliamente con WCAG 2.1 AA (ratio >= 4.5:1). Se añadieron pruebas exhaustivas que verifican la accesibilidad y el renderizado en modo claro y oscuro.",
  "findings": [],
  "next_steps": []
}
