{
  "verdict": "approve",
  "summary": "La configuración incluida cubre la estructura, los comandos y la integración HTTP requeridos. No encontré un defecto confirmado que deba frenar el merge.",
  "findings": [
    {
      "severity": "low",
      "title": "El requisito de Node documentado incluye una versión no soportada por las dependencias bloqueadas",
      "body": "El README indica que Node 22.12+ es válido, pero el lockfile registra Angular CLI y Angular Build con `engines` que exigen Node `^22.22.3` o superior. Un desarrollador que siga el README con Node 22.12 puede instalar o ejecutar una toolchain fuera de soporte y obtener advertencias o fallos de build dependientes de esa versión.",
      "file": "README.md",
      "line_start": 7,
      "line_end": 8,
      "confidence": 0.9,
      "recommendation": "Actualizar el requisito mínimo a Node 22.22.3+ (o fijar una versión soportada mediante `.nvmrc`/`engines`) para que coincida con las dependencias bloqueadas."
    }
  ],
  "next_steps": []
}
