{
  "verdict": "approve",
  "summary": "Se implementó el endpoint POST /api/v1/visits/{id}/complete con control de acceso horizontal por operador, bloqueo pesimista, idempotencia y registro de auditoría. Se añadieron pruebas de integración exhaustivas que validan todos los caminos de éxito y error.",
  "findings": [],
  "next_steps": []
}
