{
  "verdict": "approve",
  "summary": "Se revisó el diff de frontend (DeviceStatusBar, helper de contraste compartido y sus tests) contra los 7 criterios de 01-spec.md. Todos se cumplen: los textos toman color de useThemeColors() (9.90:1 en claro y 12.02:1 en oscuro), el aviso del GPS usa danger en negrita (6.18:1 y 4.74:1), la barra declara su propio fondo bgBackdrop y el chip «Modo conectado» pasa a 5.02:1. Los 77 tests de src/components y src/constants pasan, y tsc y eslint no reportan nada sobre los archivos tocados.",
  "findings": [],
  "next_steps": []
}
