{
  "verdict": "approve",
  "summary": "Se verificó el movimiento de los archivos de test de login y agenda fuera del directorio de rutas de Expo Router hacia src/__tests__/app/ sin cambios de lógica. Se constató la incorporación del test de regresión automatizado routerDirectory.test.ts para prevenir la reintroducción de tests dentro de src/app/.",
  "findings": [],
  "next_steps": []
}
